{
  "$schema": "./capabilities.v0.1.schema.json",
  "version": "0.1",
  "description": "The capability surface, as a single declarative source of truth: the door catalog, the room table, the auto-granted doors, and the storage single-writer map. Both the TypeScript implementation (claude-box.ts knownDoors / launcherd.ts ROOMS) and the Rust implementation (launcherd-rs doors.rs / rooms.rs) are validated against THIS file, so the two can never drift. Invariants I1-I5 are stated in contract/INVARIANTS.md and enforced by the validators in tests/contract.test.ts (TS) and the parity tests in launcherd-rs (Rust).",
  "doors": [
    { "name": "keeper", "socket": "keeperd.sock", "env": "KEEPERD_SOCK", "mountable": true, "bootRequired": true },
    { "name": "net", "socket": "netd.sock", "env": "NETD_SOCK", "mountable": true, "bootRequired": true },
    { "name": "scout", "socket": "scoutd.sock", "env": "SCOUTD_SOCK", "mountable": true, "bootRequired": true },
    { "name": "auth", "socket": "authd.sock", "env": "AUTHD_SOCK", "mountable": true, "bootRequired": true },
    { "name": "beads", "socket": "beadsd.sock", "env": "BEADSD_SOCK", "mountable": true, "bootRequired": false, "interface": "beadsd@0.1.0" },
    { "name": "launcher", "socket": "launcherd.sock", "env": "LAUNCHERD_SOCK", "mountable": false, "bootRequired": false },
    { "name": "dispatch", "socket": "dispatch.sock", "env": "DISPATCH_SOCK", "mountable": false, "bootRequired": false }
  ],
  "autoDoors": ["net", "auth"],
  "rooms": [
    { "name": "dev", "doors": ["keeper", "net", "scout"], "dispatchable": true },
    { "name": "dev-spawn", "doors": ["keeper", "net", "scout", "launcher"], "dispatchable": false },
    { "name": "readonly", "doors": ["net", "scout"], "dispatchable": true },
    { "name": "offline", "doors": [], "dispatchable": true },
    { "name": "planning", "doors": ["scout", "beads"], "dispatchable": true },
    { "name": "bootstrap", "doors": [], "netOpen": true, "dispatchable": false }
  ],
  "stores": [
    {
      "volume": "prx-dolt-data",
      "writer": "dolt",
      "readers": ["beadsd"],
      "note": "The beads work-unit store. Exactly ONE writer (the dolt.container Quadlet unit). beadsd reaches it read/write over dolt's netns but is not a second SQL server on the volume. Nothing else may bind prx-dolt-data writable (I5) — in particular the retired prx-pod dolt must never start a competing server."
    }
  ]
}
